{
  "id": "11111111-1111-1111-1111-111111111111",
  "action_id": "22222222-2222-2222-2222-222222222222",
  "effect": "DENY",
  "policy_id": "policy_prevent_unscoped_active_scan",
  "reasons": [
    "Cyber active scan requested without valid SecurityScope",
    "Public internet target not allowed"
  ],
  "constraints": {
    "block_egress": "true"
  },
  "evaluated_at": "2026-10-02T16:00:01Z"
}
