{
  "id": "11111111-1111-1111-1111-111111111111",
  "action_id": "22222222-2222-2222-2222-222222222222",
  "effect": "ALLOW",
  "policy_id": "policy_dev_project_write_v1",
  "reasons": [
    "Developer role permitted to write within project worktree",
    "Target file is within permitted scope"
  ],
  "constraints": {
    "sandbox_mode": "restricted_token"
  },
  "evaluated_at": "2026-10-02T16:00:01Z"
}
